text,sentiment
feel like love romantic comedies sort mixed tone woody allen work obviously jim brooks earl billy wilder films like apartment,1
feel give perspective least provide context seemingly intelligent folk say things,1
feeling pretty homesick weekend,0
feeling doomed moment laid eyes still thought judy glasberg href http,0
feel fucked tape last year make sure get,0
must feeling rich,1
feel ok go world work buy food go walk,1
dont know feel frantic really want particular song little girl,0
look scene think cute enjoy swelling feeling pride playful delight dog,1
woke feeling pretty energetic yoga shower really hungry,1
always read feel hesitant comment unsure say,0
feeling impatient many ways equally aware important learn im season,0
feeling bitter towards responses kind cold,0
already imagine feel excited im,1
want passed away not feeling good brother grandparents,1
fascinated structure function brain incredible everything think feel memories emotions created stored strange convoluted structure,0
know children feel valued equal members family,1
rarely feel happily joyful dont walk smiling much,1
think one site truly made hella smile feel reassured morally good kind individuals world,1
feel cool cool cool cool cool girl feel cool cool cool cool cool girl,1
used feel pretty friendly started spouting russia running muck no reason dont give shit citizens cant trusted,1
feel little bashful,0
feel like generous completely understand things change mean days unpaid,1
feel like ive become relaxed parent,1
feel uncertain motives feel inbalance committment process counselling reconciliation,0
feel absolutely guilty crazy time pregnant suppose get rounder,0
feel determined regain routine proud,1
feeling upswing mentally felt well stable,1
trust moments feeling fine even moments joy may sometimes come slam face,1
feel like almost convinced going pattern,1
feel innocent cuz aint mean bitchy,1
feel embarrassed even typing absurd words truth son living countertops since brought puppy home two weeks ago,0
feel tortured not allowed enjoy food way friend,0
feel strategy worthwhile,1
feel like carrying super low,0
pretty tired feeling little homesick not mood mingle,0
feeling homesick somewhat wondering,0
feel like worthless ugly fat unattractive piece shit,0
feeling defeated usually pick things easily way getting,0
show feelings well family fans either,1
never cease feel amused single facial expression power modifying students behavior,1
feel fooled played relieved,1
finished work saturday got home teased half right wrong fancied roast beef roast potatoes full trimmings feeling quite smug,1
feel like im living life romantic teen movies watch,1
feel like ever start feel happy consistent amount time end,1
could sense uncomfortable came deliver letter willing attribute feeling weird romantic vulnerable,0
feel accepted welcomed,1
im feeling really strong since starting shred two weeks ago new muscles,1
feel students classroom hostile towards display intellect like rest society,0
trust plan stay true listen promptings heart feel assured everything okay worked plan,1
feel even determined keep per week tradition son,1
feel pretty lame together stop share bit fudgy mediocre doodles,0
feel humiliated weekend children ran wild,0
still feel like somehow one family members horribly wronged tragic events transpired today,0
know feels like popular boy band top pops looks like heading one direction,1
feel lonely work im not social bird usually school,0
truly surprised feel quite honored,1
feel like hot mess probably,1
didnt feel welcomed first entered morris quickly changed left feeling happy,1
fabulous week though convicted saying turned around health thankful trying share positive people,1
feel confident today front nine,1
feel like kinda bitchy alot people whatever,0
really cant count number times cried feeling overwhelmed someones expression concern fact thinking,0
feel suffocated paranoid,0
still think shes insensitive feelings glad im not shoes,1
said fb feeling strangely discontent tonight,0
feel quite surprised fairly significant amount blog readers,1
im fine mary anne answered feeling little impatient,0
feel like take time care flowers wonderfully loyal hive,1
tell whenever feel hesitant start muay thai,0
feel confident company bothering,1
feel privileged watch beautiful dancers move call work,1
usually month without feeling homesick,0
dont know feeling fab lous today,1
feel moon guy liked started class cbc read href http jazzyboy,1
look long without feeling depressed,0
dont know cant help feel innocent yet awkward feeling towards,1
push back repressed expressions child split marriage say no chance late feel enraged situation wan na yell top lungs fuck aint fucking problem dont make way,0
want someone feel safe around isnt gunna make questions explain things time guy understands gets,1
feel even killed agonized extent,0
didnt use feel embarrassed walking people pool,0
glad,1
feel comfortable not far would like,1
feel foolish long runs extra miles best muster nearly seconds per mile slower year ago,0
burst tears devastating release feelings thoughts seemed know rich also go space without dumping,1
im feeling somewhat nostalgic game fact star wars,1
feel safe tucked away,1
know easy feel little envious cant tell shouldnt,0
know whos interested renaissance baroque art relate jamie like feels tender towards everything thinks inanimate objects feelings,1
feel im unhappy,0
feeling like beluga whale quite grouchy,0
know seems sudden everyone not sure much communicate comfortable feel similarly look world supportive loving towards,1
feel much productive college keep productivity full gear ill chalk ideas art projects summer train army attack pigeons take tiny uninhabited island,1
posted reached someones facebook used think one best friends makes feel shocked frustrated,1
feel less pressured check phone gain better space concentrate important life,0
still feel like kid eager blow candle open gifts good stuff,1
feel beaten,0
im trying better spending feel deprived,0
days prefer submissive simple life feel days submissive best please seems happy enough two years,0
feel relaxed happy im water,1
feel like im talented enough really deliver line make listener hear,1
feel virtuous writin morning journal like jane austen novel aided fact mr gs computer kinda,1
feel ecstatic happy anxious,1
feel like not accepted bucking force coming quarters tells something wrong not married children,1
im feeling shy im feeling mad im feeling sad,0
feel relieved ready move next series challenges life offer,1
want federal prosecutor dc feels like perfect place pursue legal career,1
feel like accomplishing something feel passionate life,1
ill smoke cigarettes im feeling little nervous,0
feel like go supermarket buy something totally delicious dinner money mother put account today,1
im hoping theyll like new draft better time wont end feeling devastated last time turned draft devastated href http neuroticworkaholic,0
feel like ive talking creation stories forever im excited able move,1
feel sweet boy traveling difficult road alongside,1
feel ultimately ok,1
love way feel hand im sort shocked dont psycho fetish,1
also feeling awful,0
feel hire billy sasha not pay billy play catch work missed,0
wasnt alone crazy feeling disheartened,0
used feel sadness fond memories formation friendships tec parishes,1
feel lot life live delicate balance clean utter mess,1
feeling horny let,1
look forward attending every class leaving feeling amazing feeling top,1
feel little needy,0
feel defeated,0
feel like missed every single holiday last year hitting hard year,0
feel like fact abused,0
feel satisfied sad time,1
feel hostile thought taking credit card,0
think feel entirely wonderful wife dating someone order go okay happen,1
not feeling joyful might urge,1
feeling robin builds next deck getting pissed,0
mm comfort need get creative composition,1
code making stupid people feel smart,1
feel glad mu tou cause tolerate give massage leg cramp,1
im feeling relaxed sometimes im feeling productive quiet wan na fun yknow,1
feel obama simply hillary hated many,0
feel stressed frequently,0
no longer even remotely ok body feel ugly person swore love,0
reported feeling marginalized intimidated subjected threats retaliation,0
feel prizes finalists,1
im not mistaken thai business leaders dinner feel ashamed setbacks held thailand back full potential,0
feel people ought use percolated synonym horny,1
really dont feel sociable bar anymore,1
could feel strongest connection still divine self,1
feeling overwhelmed daily responsibilities expectations family job demands time physical tiredness feeling burdens overtake financial hardships,1
went bed feeling utterly miserable last night,0
feel like day starts around lunchtime kind feels awful,0
feel like shop smart still add things wardrobe without breaking bank,1
im feeling funny totally unnecessary,1
feel not strong enough let negative thoughts feeling not effect,1
need manage spending money wisely im feeling uncertain stressed late,0
say happening eastern part country feel quite safe,1
feel know basically like fake realm science fiction,0
started feel sweet feeling peace,1
quite figure feel not devastated like lucy not sure easier first time,0
im working new project feel productive,1
feel completely hated things exercise democratic right speak mind ever ways possible try enact change,0
feel weepy like moment could burst tears,0
really badly not wear anything without causing spasms diarrhea eat mouthfuls feeling miserable,0
feeling restless irritable discontent,0
starting feel compassionate towards roslin,1
continued feel way next couple weeks convinced take pregnancy test sure,1
feel rather imbicilic least complacent,1
feeling grouchy everything past weeks yesterday happy day,0
still feel incredibly listless albuquerque least weather improving less,0
feel delighted varsities picked muse,1
choose feel deprived empowered,0
would feel really dumb,0
not know damned centuries hone words wielded razor edge hindsight not help feel resigned fate inevitably followed helpless withstand,0
see women wearing boots feel envious want curse,0
feel hesitant since experience programming,0
feel helpless hope somehow receiving dose drugs help get threw hard times,0
feel like not moonlighting type show tension resolved end,1
im happy race pace officially ability pull together started feeling crappy,0
feel much better back university,1
feel reluctant supply motion picture score stars,0
feel bit jaded weary world,0
kind feeling lethargic day,0
id love see campaign go viral help raise awareness funds support hotline women children feel safe something us take granted,1
evening brilliant night fantastic run feeling jolly darn good,1
like listening hardcore sxe music one thing lets feel rebellious not chocolating spending till gone,0
feel wonderful see aku merasa luar biasa karena kulihat love light eyes,1
need able pursue creative opportunities crave without feeling like throwing family bus funny still want fed even big gig prepare,1
feeling bit overwhelmed tired anxious etc,1
much regret allowed khartoum convinced never rally present descara,1
receiving grade paper mentioned fear,0
feel unpleasant time long,0
noticed earlier not involved group turn speak front class could feel nervous,0
havent let truley sink depressed state mind feeling like everyone trusting no one basically wanting die since freshman year,1
im feeling awfully spiteful right,0
tend not want cook feel grumpy tired stressed,0
feel innocent free,1
feel anxious,0
feel like would make startled person laugh think would nice eid gift,0
no longer hard feelings luckily unexpectedly met sweet interesting girl tumblr aiw fan also runs wonderful alice wonderland blog called still haunts phantomwise,1
feel tranquil right,1
celebrity politician hire bodyguard carries gun apologize explain feel embarrassed choice,0
feel unwelcome,0
truly feel blessed sharing first thanksgiving day together many many blessings thankful,1
may not completely sure lot things opinionated person opinions something feel strongly stubborn comes especially comes politics,0
feel incredibly slacking mrs greedy guts still desperate search unspoilt base career ladder,0
also reply comments please feel free share thoughts let talk,1
feel instantly glamorous pulling handbag sachaying see,1
feeling really quite disheartened,0
feel shame never change sweet la la la la long watching jajaja,1
vent outrageously tourette like unpredictability occasionally leaving behind wake hurt feelings messy rooms not nice carnage,0
refuse feel guilty,0
like buck system climb soapbox feel wronged see others wronged part comfortable society accepts certain behaviors moral truths,0
pub instead stayed home feeling morose depressed,0
know continue feel dull ache leg going forward not,0
feel like life anything glamorous,1
went upstairs feeling gloomy disappointed switched phone silent mode watched notebook instead,0
feel like starting understand blessings come submissive father,0
ive feeling like im running empty fearful ill get usual progression sinus infection walking pneumonia ive pounding href http,0
said felt needed said addition feeling bitchy,0
needed supportive caring understanding loving made feel broke despite could tell stressed whatever place held heart no longer kept,0
feel pain ways tortured ti could possibly understand,0
came airport makes feel irritable uncomfortable even sadder,0
feeling unsure words also means writing good,0
grown blessed proud say healthy year old black male no children feels good,1
feel shocked words pure self,1
sat group feeling really depressed book go missing time,0
feel saddened stop caring,1
feel sorrowful dejected words ring head damn affected everything say let go want happy,0
grateful every single thing maybe ill start feeling dismayed,0
feel ecstatic relived bottom heart truely grateful,1
wake feeling kind dazed groggy,1
could tell pain feel heart abused torture duration life,0
feel ugly sad want stop comparing,0
imagine ill eventually migrate middle even alone feels greedy,0
feeling impatient took pills,0
still feel really regretful leaving,0
feel write truly innocent even though quite bit feeling involved,1
feel im forever alone,0
feel troubled guess would best word,0
feel sad hopeless,0
feel curious one think might fall love uncle montagues tales terror,1
mean good level terms everything well thought executed constant mirror puzzles topping crap final boss battle made last level feel rushed comparison though last boss bad no matter way slice,0
cant even pay attention feel lame watching,0
id like write something interesting right unfortunately feel deprived inspiration,0
need know pain feel not vain better brighter day future,0
feel welcomed times id really walk away feel dont want,1
feel solemn duty share divine knowledge mine order others may benefit truth beauty render world tad closer thearchitecturality utopian perfectly set garage society strive,1
feel like dangerous animal prowl jungle onto warm sand deserted island,0
feel like pains not imagine becoming passionate group idea causing pain,1
ive intensely feeling unloved,0
tend lose feel water pretty quickly im not water every day felt race,1
thankful feeling useful,1
feel like may missed opportunity,0
didnt feel needy didnt feel emotional,0
feel truthful usual days,1
awesome husband got lay bed two days straight think directly linked fact im already feeling much better,1
wake morning sexy dreams feel horny need fuck,1
feel wronged certain people instinct get angry stop speaking two wrongs dont make right think,0
really feel unfortunate person cary,0
feel keen leave country atm,1
told living wyatt makes feel like bowie living iman gorgeous long limbed ebony creature striding lounging,1
ill admit feeling nostalgic see photos sweet little girl halloween costumes made dream day ill called upon fashion small costume grandchild,1
feeling time wrote say like oh dont worry leanne youll find prince charming someday,1
feeling remorseful breakfast took diet pill,0
im feeling relaxed,1
feel people usually prefer truthful would rather make many different things tell lies,1
posting past event feeling like insulted,0
feel honored call rex dingler friend,1
not feel pretty might add,1
always feel like ive assaulted pics,0
havent hopped one yet definitely speaking cardio exercise feeling kinds superior href http emilyhursh,1
feel glad chosen batch,1
thankful slow sunday not feeling hot,1
would feeling miserable today,0
remember im feeling ungrateful would great,0
id love know comments feel like funny thing always love reading people schedule days,1
im work hes school likely feeling like garbage suffering day really home snuggled bed mom making chicken soup lunch,0
feel not threatened idea caring care far often,0
like strangling horny bastards schools people banging boats not even syaing,1
feel foot aching thigh numb knee hip although gained weight feel like shifting middle feel like little trapped crumbling body,0
feel like heartless kingdom hearts really stock character born without feelings watches enviously normal people laugh cry love feel things,0
hope feel bit creative soon miss presence life blog,1
say never truly gets choice freedom decide life makes hard not feel like got less dirty end really shitty stick,0
know scones not must food determined live frugal lifestyle without feeling deprived,0
get bike days straight feeling tender day playing rugby good prep,1
like much feel like somehow term becomes popular future,1
felt sick watching feeling helpless,0
want feeling not caring unnecessary stuff like felt,1
wish pasta dish combined beet rabiola fresca ravioli naked pasta feel like two dishes encompass yin yang case sweet savory sides perfect summer pastas,1
said words devotee feel relieved hear title deen bandhu fallen person become afraid title uplifter devotees consider true devotee hence unworthy benefit aspect personality,1
feel relieved big moving furniture,1
feel needs title cant think one,1
feel shy people reading writing brothers sisters would see real life works,0
feel confident already href johnnykaje,1
name opening passages saying may strike reader rather singular far fetched may feel assured no means far fetched circumstances would impossible give name,1
im excited try mineral makeup starter kit feel gorgeous beautiful confident youve ever felt im willing give incredible deal,1
like present life working mum standard ever miss apostrophe miss particular word please feel free call,1
like jokes like good company subkect talking like make woman feel horny,1
feeling cranky not cooperative allowed sleep relax not given opportunity not fault body slam bosses harass museum visitors,0
feel disappointed ex girlfriend call back,0
want say front embarrassed feeling comes mouth dumb not say im love know dont like front eye im not pretty like think mind thats not reason dont love right,0
cycle ever feeling finishing manchester blackpool miles not bothered ride extra mile put,0
irritated knew wasnt pregnant wasting time feeling lousy no reason,0
felt apprehensive regards party oftentimes past men made feel resentful towards attended,0
say feel fear surprised calm,1
feels lame,0
ran upon looking cute saying add address change cards planning ahead feeling positive,1
personally feel god gentle kind dont think wants enter friendship,1
feel share wonderful business concept change life like little time spend kitchen grocery shopping browsing net new exciting recipes,1
know loves showers graces never need feel unloved rejected lack anything not time things money,0
feeling pretty excited,1
feel hesitant share something know experienced personally offer hope amp eternal life,0
finally cast studio show feels fab,1
didnt want aubrey feel pressured rushed baptism realized doesnt need perfect knowledge order baptized,0
feel strange sitting blogging away amp not study,0
feel pathetic encased stiff unused limbs mind plateaus dreams beyond,0
sometimes feel overwhelmed hats wear trying figure real emily,0
think also feeling restless,0
feel extremely disappointed took granted,0
feel overwhelmed clean anything let pile makes whole life feel like going come crashing around helpless stop,1
still feel shaky gradually getting better no idea going,0
im feeling bit apprehensive excited well,0
still feel amorous,1
im supposed feel compassionate towards little girl feel like never existed,1
finished reading feeling insecure,0
wanted feel accepted,1
feel rather petty dont time someone talented like christine make,0
saw post one girls facebook page said something effect im feelin horny,1
feeling sorts anxious not sure,0
make joyful focus,1
im starting feel like faithful reader wife something ie one bitch everyone else gets see better angel nature haha,1
feel heartbroken mostly daughter adjust new daycare center,0
make today bonus feel like today already worthwhile,1
feel discouraged industry enormous makes special sea pretty girls,0
keep feeling disgusted,0
feel like im getting less intelligent day,1
not like feeling unsure uncertain,0
sensed much offer also many many times behaviour made doubt not make feel special times frankly rude immature,1
cant help wince feeling unpleasant tightness back dull ache head since ive opted resting wall behind,0
feel confident personal life right work life going well boss slowly understanding continually ask demand address tough issues cause problems various departments,1
feeling rejected sad,0
feeling generous seasonal,1
feel tat us world clever depending born born er not good still would good things dun realise lol noe quite lame hope no one read img src http shared,1
feel like thats vicious circle,0
would also change floor pleasant feeling dog friendly flooring,1
feel awful experience not reflect,0
lose best friends one make feel forever contented life eternally happy,1
finish typing post realise ok no longer feel annoyed angry even sad,0
guess right feel way dont know lately havent faithful member christian faith,1
control issues though really kick badly feel unprotected dont trust safety net,0
slowly realized even next day six hour effects worn feeling energetic could concentrate working emotional crap better,1
feel grumpy short wife children,0
body scan realized everything feeling amazing,1
feel like much could community loving children excel,1
feel conection beloved letter beloved envelope customized,1
couldnt shake feeling left somehow sort hated done,0
brought privately couple weeks ago felt targeted feeling frustrated belittled,0
easily feel quite pressured routines really noticed difference away,0
feel particularly uncomfortable much driver looking phone shout eyes prize,0
remember watching feeling devastated sheer familiarity,0
feel like entered relationship mike became unwelcome life,0
need constant reminders go lulls feeling submissive whether like not,0
desperately want able help feel helpless,0
still feel terrible right happened monday night needed time recover sharing sleeping since happened,0
feel india management must regretting vital mistake made wc made deadly mistake dropping laxman dinesh fielding qualities know laxman not bad slipper,1
brush side tuck behind ear feel rebellious strands escape tickle cheeks lips realize im not one control,0
see wednesday im feeling fantastic days tell im getting smaller smaller,1
know sasha fierce feels definitely curious future beyonc sound,1
bought expensive pair shoes ive ever owned whim weekend love feel remorseful pang every time look,0
know better teacher feel lesson pleasant language work less artificial feels good teach closer need instead someone else not even thinks need,1
feel increasingly energetic comfortable inside,1
feel like ive gotten know many comments emails im appreciative glad part little space,1
really love feel lipsticks colors really gorgeous,1
feel like welcomed freedom life past several years,1
sometimes feeling entirely no reason,1
feel positively ashamed look window see state things,0
im feeling stressed retail therapy way,0
help feel amused reading article,1
feel sad discouraged,0
ended episode feeling really pissed,0
could feel depressed since im always known labelled happy blessed,0
feel twitchy physically agitated,0
fared pretty well feeling quite pleased journey went well,1
confess feelings still couldnt bring scared losing,0
feel truly impatient taking long,0
really felt quite good safe baby home although always risks still feel blessed everything turned,1
couldnt help feeling little bit bitter towards great big happy grin,0
read new risen throne said cold amp desolate soundscapes leave feeling utterly scared amp alone yes,0
carried phone pocket feel pull get lost,0
needed look something assist us not bring good feeling supporting family,1
feel reader loyal subscriber need informed great butterfly marketing really not taken ride bank chunky commissions,1
feel fearless post grieving days,1
feel clever,1
lost distraught mainly state feeling helpless,0
feeling quite weepy get rid,0
always feel dull morning,0
checked lyrics realized song talking getting dreaming supposedly inspires creativity makes feel real,1
failed entrance exam medical school studying biochemistry no job prospects zambia,0
know im not best place life still dealing infertility issue feel lot thankful,1
love reading feel positively rich full new books learning new things really pace spend pottering job job depending stupid feel like,1
wonder feeling sentimental help agony writing report dues tomorrow,0
still feel stressed,0
im feeling irritated friggin name,0
ive stayed trendier hotel north america tendency feel cool unfriendly,1
hoped would would feel disappointed depleted,0
feel kind heartless,0
feel relieved time feel lost,1
feel satisfied happy choices today,1
woke feeling grouchy irritable feel settled day remove patio small read school book ended storming house discovering still flush toilet,0
