text,sentiment
im half asleep absolutely blissed feeling purely ecstatic know stage tonight dancing spotlight follow like adoring fan,1
feel gentle hands careess tender care across curled shoulders pulled towards embrace sun reaches towards searching face,1
wanted feel special guests alise jeremy chose,1
discovered gave great feeling satisfaction produce blog post delicious dish photos written recipe tangible job completed feeling rare life stay home mom,1
im not convinced makes since talking never feels sincere execution maybe themes life seem large ever fathom point already feels like emotionless pit self craving attention,1
tend keep mouth shut im not well enough informed comes public education speak feel thats one topic im passionate best keep,1
feel hurt lack thought knew busy needin drop beth takes second bob give kiss goodbye even text,0
feel unloved know im hated,0
li pouring corner moonlight shines face saw pale face mouth half closed eyes bear people feel distressed,0
feel really pathetic confronted,0
feeling opted shoot photojournalistically completely prop free personal fave mine,1
feeling stressed run support immune system,0
made work feeling little groggy,0
ive lived life trying hard accepted feel loved,1
always access feeling stressed usually time need silence,0
becoming definitely want include impulse sense resonating feelings others like sympathetic string way able let go life emotional,1
find despite fact feel like really liked book certainly read entire thing like physical need find happens next cant think anything say,1
looking forward great year feeling optimistic hard yet busy,1
feel met author would get along writing seemed friendly formal,1
ive breakdowns ive feeling depressed three four days sticking old sleeping pattern feeling pretty great not best better normal,0
feel dazed empty like somthing missing brain,1
really not anything feel dumb daughter,0
im going sleep still feel,1
also feel less inhibited interacting,0
know thankful warm loving peaceful presence feel anger feelings discontent frustration flare,0
could feel accepted,1
kinda feel relaxed blog one,1
feel absolutely amazed unfolding story life,1
really hope shares feelings would wonderful together,1
say first listen yunhos raps gave wtf feeling listening couple times im determined learn,1
feel think im always glad theres something dont no im one whos feeling sad,1
love cars feel second attempt owning one pleasant one,1
feel hardly loss since food kao chi not delicious also budget friendly,1
sat windy beach feeling thoroughly annoyed vowed id back would climb scafell,0
wear makeup not reflect beautiful truly feel inside also break stereotype nerdy timid loop woman sciences,0
get feeling miserable narrator pining ex lover dreaming return wonders whether unlock door case come way drink dancing,0
understand nice not feel like weird one,0
watching violent movie,0
depressed actually feeling inspired,1
feel like tortured whole time,0
ive always giver not taker feel selfish considering idea,0
feel sad ignore pretend dont feel anything,0
ive feeling like im shaky quilting waters started questioning work,0
im feeling far mellow normal,1
feel feel tell together apologize make keep loving bits bits,1
assume not feeling cold like water not frozen plenty feed though eschew favor foraging scratch,0
watch dramas order feel like mood not isolated incident,0
feel kind ashamed write things like sat couch watched antm marathon,0
like church sundays makes feel virtuous self effacing settled week ahead,1
im feeling bit smug im number things already walking cycling advocacy lots fruit veggies whole grains attending service every sunday,1
feel deeply humiliated read ari ben menashe book entitled profits war mousavi friend manuchehr ghorbani cia agent,0
feel tortured looking lecture notes nothing going except holiday plans,0
felt distinct feeling told everything would ok things would ultimately turnout good,1
almost started feel like wimpy popeye cartoons,0
remember feeling bit confused really questioned saying,0
get exercise feel like im something worthwhile meantime,1
feel like josh pretty needy guy,0
im deep budget spreadsheet feel im someplace dont creative work,1
feel way considering people pretending way sincere,1
feel like loyal microsoft rest life,1
warming starting feeling little lethargic,0
feel bit naughty like ive snuck parents room snooping christmas presents something,1
not feel insecure unsafe,0
feel humiliated annoying little college student takes causes pesters everyone,0
feel rejected tossed aside hurt long get enough guts pick move,0
must feeling little cranky,0
im still feeling emotional,0
feel though time not valued,1
feeling confident able take care baby,1
feel reassured know good luck world,1
feel vulnerable im alone not feel incapable defending also could go labour point,0
feel angry cancer slowly killing dad,0
kind life girlfriend would feel lonely sure,0
loved still small enough ask help feel safe,1
ive spent last half hour feeling ridiculously angry insensitive comments partner changed minutes ago real pride much changed,0
feel even disturbed happened prior going sleep,0
feel passionate,1
feel dirty cheap talking going far,0
feel want need know need bleed fucked world,0
think tell feel moment see looking something dumb,0
think anticipation feeling yesterday kind miracle didnt like fake injury something able go hospital see,0
feeling pretty rotten,0
sister lost one twin sons first nephews older one died week later,0
feel like im hated girls becoz im good dancer,0
still managed feel tranquil appreciate archeological wonder,1
ive written blog post feeling even energetic,1
practically perfect every way right every happy,1
feeling bit nostalgic today,1
feel truly honoured accepted invitation participate project,1
feel hated parents,0
feeling annoyed suddenly,0
not want folks think feel superior due aspieness near genius iq,1
hate sitting hostel writing feeling perfectly fine get home problems wall,1
finished drinks left came feel sympathetic bad old man point im still thinking hours later,1
feel super lonely dogs least together im not tdy time anymore,1
see feel knew could get angry putting key lock want punch someone face every single time put key lock know must keep going,0
shy away songs talk feel toward god maybe even talk faithful response toward god,1
completed feeling invigorated not sluggish ffvi,1
stopped feeling mad machine stole money chose instead feel grateful clothes wash first place,0
feel quite devastated rush away sometimes,0
thought later feeling anxious worried,0
still recall feeling peacefulness tender smile warm hands,1
feel like selfish bitch feeling way countless impoverished people suffering surely hundred folds,0
im still feeling pretty gloomy truth told,0
feel see frantic thus afraid,0
chinese mum chinese sisters spent two important years life china someone knows conversation like one feel pretty hopeless power education,0
slough carapace past thirty odd hours feel invigorated finally ready face day,1
feel superior actually know president,1
asked lead prayer meeting feel solemn responsibility prepare spiritually plan carefully,1
feel captures peaceful serenity relaxing inviting pines lake,1
feel fearless janelle mon elle canada february img width height src http,1
ive never made anything book look quite scary complicated feeling brave,1
feel beloved husbands spirit strongly indication another breakthrough imminent,1
feel divine,1
feel isolated im not much driving bad roads,0
last posted blog feel bit like neglectful mother,0
im pretty picky folks link want list sites worth valuable time,1
feel impressed professionalism specifications maintenance sets,1
feeling many sarcastic quotes future posts yikes,0
input class size medium wp image height src http techfeel wp content uploads google hindi input,1
feel kinda mellow though think time month going turn raging bitch moments last night felt totally angry like cranky really restless,1
feel tons love give would love give loyal support person well,1
get feeling im valued potential welcome,1
worked today writing making sure rest house perfect could make feel peaceful sense order pm linda writing always makes feel better accomplished,1
feel greedy thoughts relief let linger,0
im afraid call guy yesterday think hell angry think boss angry dont communicate feel like im shitty job project fears onto,0
brave express feelings tomoe despite rejected,0
could follow every twitch thought swell feeling quiver tortured expression,0
feel respected feel like worth something,1
favorite cookies house oatmeal chocolate chip hard stay away since im feel pretty discouraged lately,0
feel like doomed,0
feel assured saying world could one heck pacesetter hands,1
sincere,1
feel content present giving full attention weather masterpiece,1
im feeling little melancholy end year,0
went everything feeling fantastic right,1
not extremely good friend someone course feel reluctant extent favours someone,0
feel like life affectionate older sibling,1
want feel disrespected unloved,0
sent boyfriend bobby feeling particularly melodramatically helpless miss home states miss sweatshirt miss taco bell,0
feel like spite many amazing things thankful life one big demanding wave wave tossed around like rag doll,1
wasnt feeling playful drunk,1
im not feeling pressured perform athletic moves order stay field,0
feel disappointed,0
know sweetie turning month still years old hard comprehend going except feeling pleasant,1
feeling delighted bigger definition magic,1
feel sorry employees way applebees ceo behaves best chain starved death caring consumers,0
remember feeling relaxed last summer boat,1
feel life not make sense would help lot suffering made sense,0
cant tell moments shock im not feeling im jaded lovecraft actually missed note use musical analogy,0
sort feel like one people unfortunate lost father life goes,0
im feeling little overwhelmed,1
im lacking accessory department feeling actually start putting things one place might little surprised find,1
im feeling determined,1
feeling bit crappy not bad two weeks ago,0
practically got feeling hostile environment,0
im feeling seriously pissed something fantabulous utterly stupid,0
feel frightened hear mighty roar,0
feel privileged honored able represent college prestigious event,1
im feeling whiney,0
feel compromised skeptical value every unit work put,0
feel guilty family friends made introduction job somehow even feel guilty boss even though fooled lied,0
feel pretty fucked days cant breathe properly,0
try get least minutes day five days week though known skip workout feeling particularly lethargic lazy,0
need upfront feel im valued work,1
constantly tumblr feel free follow poetry blog riotousrambling,1
feel grouchy not think properly deprived food two hours,0
feeling relieved right,1
feeling bit groggy today,0
feeling spiteful encouraged bit information,0
feel little jealous people sitting coffee shop leisurely like morning,0
feel helpless yet motivated something,0
im feeling completely mellow perfect tonight,1
feel leader admired selfish,1
feel much relaxed going race,1
hate living dads roof gives excuse asshole hes providing live think feels needs make feel unwelcome possible ill leave,0
got feel kind joy college even still caring others providing others generally elizabeth,1
feel uncomfortable word hero,0
wanted press charges people street guess didnt feel like bothered,0
feel valuable,1
feel like theyre rude first place long arent snappy every right ask not touch,0
surmise made sick one many times take sitcom runs come around feeling dissatisfied stationary life without much forward motion,0
feeling lot pissed people sea org hollywood scientology become monster devoured wa wonderfully sleazy bohemian area,0
feel angry im happy,0
eat soup drink tea wear sweaters still feel pleasant go outside,1
listened oral arguments case left feeling frustrated confused,0
havent gone week without exaggerated eyelids since year school feel pretty fucking shitty,0
took care avoiding family events make feel shitty,0
feel weepy lot,0
enjoy aspects life hard times not feel completely overwhelmed,1
could feel hated drawn tight feeling,0
know lot feel stupid not portray,0
feel like sweet apple,1
feel like need artistic community friend class,1
know supposed come across funny help feel sorry poor guy,0
forgive accepted allowed feel terrified not move speak scream sleep paralysis,0
feel imprinted brain vital stress college community,1
started taking mine yesterday feel kinda funny,1
think one important things not allow anything make feel fearful fear negative emotions pull vibration,0
write many entries humanly possible one day still feeling dissatisfied write everything wanted fact complain time lonely,0
feel completely blessed part group,1
feel intelligent people ones pay attention world around think issue pass judgment make decision stand,1
left feeling embarrassed stupid mission fuel coffee excuse,0
keep running hill fitness wise feel fine along foot calves starting hurt also begin tire,1
yori aoshi possibly stuff brought back lot old forgotten values feelings towards relationship anything innocent feel nothing complicated,1
also feel like excited come back like two homes,1
feeling lil groggy cough medicine,0
understand feeling like ugly brown pair shoes world designer tuxedos complete diamond cufflinks,0
grieve losses feel ashamed little way essential component life well lived get tell someone jesus love,0
feeling discouraged,0
remember giddy feeling contented good fortune lucky lucky safe cozy home watching fabulous man head day knowing coming home hours,1
ive feeling bit pressured theres little time left two books,0
took granted weeks ago really weird makes feel really agitated frustrated,0
feel little like tom daley rightly ecstatic bronze medal also feel delightful ladies wi really need fucking lighten bit,1
feel assured right answer,1
im sure know feeling cant bothered feel poo,0
feel completely totally drained,0
dont think touched book hadnt received free got past author white people problems entitled rich whining self delusions feel like got something,1
thing feelings not afraid express stand believe,0
hope everyone help charity work without feeling stressed things,0
come associate bad feelings bad behaviour continued,0
feel alittle submissive isnt,0
feel comments opinion sincere get wrong message,1
never want audience feel punished preached sorry,0
feel glad someone fine burying face crotch,1
mind feel like mind dangerous life,0
walia feels suspicious tarun bani,0
feel less stressed end day usually discover ive done,0
feel petty one first colleagues not nice things say first asked contacts investment banks arrived job,0
think want go aa meeting hear stories feels rude,0
find feeling alone,0
go shopping feel like julia roberts pretty woman,1
cried walking home bar feeling though completely ruining carefree mood later night back old apartment best friend everything seemed come crashing fun,1
still wtf feeling regretful feeling today though kiss stranger,0
come fight feeling whipped saddened hated put big girl panties pretend hey everything fine even though pissy,0
feel rejected someone needs sleep,0
well feeling bit cabin fever unwisely convinced spooky take matin screening scott stewarts legion,1
actually feel content,1
also know today refuse hate jews anybody else know feels hated,0
feel no way determine machine possesses consciousness thus whether intelligent,1
got feeling look eyes sincere,1
would save next time im feeling cranky irritable spray lightly behind ears,0
guess annoyed agiatated sis feels hated darn cos told shes geek love amy,0
feeling invigorated ready keep pushing goal,1
wonder shed feel supporting,1
feel uptight around family,0
cant help feel somewhat special,1
hate feeling anything useful,1
feel happy eat something know started seed cared along way,1
im feeling agitated today,0
finished long day work feeling bit sentimental weeks thought id get write words,0
stop feeling mad stop behaving like,0
random moments feel suddenly creative would love sit hear tick tick tick keyboard keys thoughts spilled onto screen,1
always feel flattered another amazing blogger asks share little world blog goes,1
bloods proved reason feeling lethargic rubbish low iron prescribed iron tablets,0
really feeling appreciative connected nature,1
tried three still feel longing came wanting child,1
feel even empty,0
im feeling little groggy mild headache non wild crazy evening,0
feel handling well enjoying said,1
im crashing feel irritable estrogen ish,0
know im still feeling effects rich dinners sweet treats,1
feel honored lindo guest starring post,1
feeling pretty wimpy,0
spent days problem feeling eager finish job plan go work try solution get phone tell customer div style clearboth padding bottom,1
feel little dangerous let scientists independently funded working communal labs no supervision regulation,0
feel humiliated self,0
feel lot contented lived moments trip photos,1
suppose moping misery feeling extremely agitated lot people,0
feel cant touch said love bit much wont deny broke heart cant find no crush dont come back home,0
loved supervisions come feeling like dumb dumb leave feeling heroic ive accomplished something huge,0
suppose thats wonderful means learn much quickly also make feel like idiot much way parents couldnt figure leave outgoing message answering machine,1
feel determined smash round really give something proud,1
feel ashamed oh romantic,0
not read books feel sure one man moon least not,1
typically not engage children walks manner today feeling little curious silly usual persist question,1
im feeling creative best rather student deadline meet,1
feel hesitant uncertain sometimes,0
tempted first name one many projects archdiocese underway feel passionate like restoration saint patrick cathedral strategic plan excellent catholic schools,1
feeling little lost without,0
also feel lethargic,0
read watching film argued makes sense author feel offended changes truth made film used attempt effect real life verdicts,0
feel devastated young man,0
feel privileged give dh not europe mad outbreak wont,1
feeling bit overwhelmed,1
feel safe knowing things people around stay,1
left feeling quite dissatisfied whole thing specifically dictated meds not discuss thought necessary nor lifestyle options might reduce risks etc,0
write feel oddly calm like wanting relax big chair sun,1
feel like crows roosters horses go bulls sharks monsters trying take ranch,1
feel selfish days dont feel well want left alone misery,0
always forgive still feeling hurt,0
almost always feel dissatisfied novels finish,0
gladly endure million emotional blowouts tantrums privilege feeling tender hands mine,1
kali ni feeling aku dah bertukar jadi boring benci,0
established rule comp end planning session end day resolve conflicts feelings anger anything bothered one us fix whatever,0
no idea feel beyond wanting beloved,1
feeling little awkward seeing folks,0
feel deeply honoured able offer activations made extra times available sessions full moon next week move dark moon build eclipse natural time bringing needs examined surface lives,1
im really feeling skeptical clinique products,0
feel worthless times struggling finding work,0
came away evening feeling rich friend street close,1
hear makes feel reassured towards humanity,1
im back feeling fine running,1
im happy feel not inspired crafts,1
feel no need work acceptable conversation fodder,1
could really screwed waiting sitter feeling stressed,0
love snow lol makes everything feel tranquil,1
feel frightened wanted document way feeling,0
find relaxes feel productive making food end product taste nice satisfy people,1
feel privileged experienced lovely places ive able visit throughout last years,1
allow feel emotional depths sorrow,0
think close online friends also feel,1
feel blessed given chance,1
read sentinel article hanford city councilman dan chins proposed media policy secret committee meetings feelings could summed single word alarmed,0
ive feeling restless lately bleached hair much month ago,0
cant shake feeling wouldnt liked book hadnt already felt connection characters,1
go school feeling miserable end laughing reason weird,0
feel invigorated cold,1
feel reluctant talking current situation know feel guess important know situation know go,0
feel much better without help ice,1
feel unpleasant pressure,0
feel reassured general environment recruiters look like office one either,1
im beginning feel like know terrain ive lived numb long numb feels like norm thats story ends fairy tale starts im beginning feel happy,0
feel valuable href http idreamculture,1
feel vulnerable exposed school never thought life going,0
feel agitated know quickly calm soothe,0
feel dirty even admitting ive seen much less dvd,0
feel embarrassed,0
left feeling little disappointed since started well finished little limply,0
hate feeling loyal damned company,1
dont want wax draw anything need not unibrow maybe get rid spare hairs creeping toward eyelid im feeling brave,1
read peoples posts moments feel id give left fingernail left fingernail precious one polish perfectly,1
ive frustrated dont walk around floating air seeing good every sidewalk pothole trip beating feeling unsure scared,0
feel dont believ keep faithful god gives chance feel apathetic much apathetic open mind hide feeling know youre playing show love like maybe youll gone happens,1
feel disheartened defeated,0
feeling really emotionally distraught unable concentrate,0
try describe experience words feels like trying shove tender little baby feet high tops small,1
feel eager tell guys happened days,1
longed feeling knew feeling treasured forgot pain,1
walk treadmill feel really smug day worth,1
feel agitated jumpy like ate bottle caffeine pills,0
feel like hated everything happened deserve,0
think right feel insulted,0
feel feel fantastic,1
nowhere perfect feel helpless save family far away,0
feel mad connection body decided kick side,0
feel another clever ploy played ashraf attempt avoid beating hands pakistani fans,1
feel like convinced spend night alone not choice wrongfully lead astray,1
diss bag feeling grouchy lack inspiration whatsoever comes fug bags today not grouchy still sets means big deal,0
feel around wonderful wonderful,1
feeling scared ra lot work goes job,0
feel thankful found fantastic series added favorite series time,1
doubt theres greater reluctance federal authorities employ tear gas plain force feel threatened,0
nothing compare love feel sure true deep love,1
crossed safe footing yet still feel way fearful unknown shaky uncertain,0
thought would sweetly cover really feeling say something pleasant bad things done whatever,1
want kids learn feel deeply called something something precious gift embraced loved cherished,1
feel complacent britain immediate rain life would little bit nonetheless photos goal work gap year would working early would earning,1
ive planned still days feel stressed point tears helpless good far outweighs bad honestly say im happy moment,0
feel pathetic no meaning,0
feel no matter convinced alone life journey mine not alone,1
im feeling particularly brave armpits common sense damned,1
usually feel aggravated unprofessional attitude rest cast,0
im feeling delicate today,1
feel honored take part upcoming sight amp sound greatest film poll,1
hate complaining time scary feel alone,0
feel like not pretty smart interesting enough boyfriend would feel stimulated happy someone else,1
get changed feeling insecure,0
think feel bit disappointed miss points today,0
feel pretty confident saying,1
almost fall asleep feel awkward sleeping beside,0
feel comfortable feel safe around,1
feel energized eager write tomorrow,1
take feel like would taste delicious start,1
smart though,1
passed last night late hour still feeling bit groggy morning,0
shall never rest ukrainian feel precious part inclusive ukrainian society whose historical roots diverse multi national issue,1
stand feeling threatened looking shoulder,0
find pick draw somehow feeling heung min son something special store us,1
feel cold said rachel,0
feel like never get impatient around sharp objects inevitably lead tears,0
feel see not bothered,0
transferred operating bed began feel little apprehensive,0
bloging sitting feeling content dogs amp cat etc know lucky truth,1
wonder maybe awesome excuse feel even idiotic tells know wont tell not gon na call,0
feel disturbed betrayed untrustworthy slightly disagreeable,0
often use disney cheer im feeling low past couple days no exception,0
feel cranky disconnected,0
know ended big giveaway muse im still feeling quite generous,1
feel sympathetic children world bad messages send live lawless culture full innuendo contrary,1
get saying feel somewhat remorseful not kind friend giving kind support wanted needed throughout past years friendship oh yes goes back far,0
kind feel like investing internet dummies type book im really not bothered status internet pariah,0
feeling reluctant overwhelmed try think alternative abandoning dream,0
would feel miserable believe misery comes not placing faith works christ,0
feel important fancy room fancy furniture nice view downtown dallas,1
wake feeling pretty energetic thats positive anyway,1
start feel muscles aching break cold sweat,0
think fair say life want feel sincere connections people experience bonding similar beliefs experiences true synchronicity people lives,1
wondered would feel bit lost got end programme time looking forward running music setting goals,0
feel safe since psychologist said rather clear suffer gender dysphoria see thats not ive made im not gon na end dropped try deal,1
know sound feel lousy sounding way feeling way sound made good contribution work today chip shoulder think mistreatment received,0
wanted root someone feel wronged condemned behalf,0
feel oddly reassured hear say,1
