text,sentiment
lying feeling maybe loved spending time fellow thought enjoyed time equally maybe ends justified means,1
hope realize little effort required make person feel better situation whether family member college high school friend neighbor street even complete stranger,1
feel getting frantic close pull turn around surprised move easily,0
get feeling life miserable waste happens less less get older btw ill look playlist page comments remember,0
guess makes feel appreciative able live life,1
feel though living world opposites long cold winter sign global warming free speech free long practiced echo chamber political correctness,0
leave feeling sarcastic annoyed treat someone though better,0
feel like staying barn carefree,1
feel everyone ability artistic special way find attractive art unleashed fromthe virgin artists,1
want conditioner make feel pretty outgoing,1
slept woke feeling much better come foggy haze headache subsided shakiness gone,1
think apologizes little much stuff not control get feeling sincere one,1
ive avoided thinking feel hurt thinking,0
insane liking someone else made feel less valuable wasnt working housewife,1
feel lucky know minority,1
tend err justice side things past years feel ive become lot jaded unwilling let god deal people sees,0
remember used feel watching tv seeing sara rue popular inspiration,1
girlfriend spent months abroad broke relationship letter,0
needs get healthy feel lively sexier years,1
let feel unsuccessful,0
feel slightly shaky headache,0
im feeling oddly festive already,1
ive somehow epiphanies toned need still work progress feel less need dont deserve attention,1
feel bad police officer,0
remember feeling completely hopeless wondering heck even miss idaho women totally different league,0
feel like longer book would liked,1
could feel moving slower generally lethargic last ride trail,0
im feeling pretty rebellious right im writing engineering class,0
really enjoyed giving class one knew answers got feel clever day two often get chance play sort things training sessions nice spend time everyone new groups came throughout day,1
id feel triumphant something,1
guess trick need go strong get want not feel bashful,0
finally know feels like heartbroken,0
feel like greedy pig catching lt bc afterward yay im gna get delicious chocolates exchange zjs gna get bai tu tang,0
feel popular special important,1
feel things lot relaxed years ago,1
dont really know im bothering homework get feeling vain,0
also know feel nothing friendly affection,1
im feeling particularly smug create,1
feel need suddenly try change accepted,1
get intrusive thoughts mostly violent ones sometimes sexual sexual ones make feel really agitated not pleasant whereas violent ones tend bother,0
feel completely lost,0
want natasha gan cos wear feel want blue suede colour ocean want want want need none stop chadstone tonite tomorrow,1
im used feeling empty dont know happiness feels like,0
ive wrestling feeling jealous envious gfs bf since hes staying,0
feel disgusted kj rel bookmark class permalink nov middot,0
ive decided whenever start feel mad tod dig deeper find real solution,0
nowhere near finished better feel ludicrous,1
pretty brazen goals day feel stronger confident going reach desired end result,1
feeling shaky weak,0
bet feel absolutely horny watching shameless blond lad make guy cry pleasure caused hottest fist fuck,1
feel honored shortlist congratulate wish nominees best tonights awards thank age scotland kindness div class intro style background color color font family trebuchet ms helvetica bitstream vera sans sans serif font size,1
wanted sacred experience feel divine communion god understanding wanted feel sublime love sacred terms,1
super high hes feeling,1
feel kind uncomfortable write not favorable review starters,0
feel pathetic times,0
feel like character precious,1
feel bit like mircowaved wasnt entirely pleasant feeling,1
expected feel hopeful definitely shed new light family,1
feel happy excited since learned many things,1
closed eyes anger feeling disgusted touch,0
know seems strange writing time honestly feel appalled behavior mother,0
feel saddened king quite respected far monarchs go ineffectual best,1
seem remember feeling contented,1
feel gotten know students pretty well parents drop students day,1
ive feeling sort depressed,0
feel frustrated sad,0
wouldnt feel suspicious muslim terrorist like blow things hijack planes kidnap use bio warfare shoot,0
feel dissatisfied distracted life,0
however tell hurt humiliated feel wonderful afterwards,1
feel relieved play jeoffrey pagetitle eyo,1
wear story protection feeling vulnerability merely loving depending another human,1
im feeling really annoyed today,0
feel like selfish keeping foodie secret would deny everyone else,0
could feel radiant heat emanating naked sex reaching longingly probing tip hardness,1
cant help looking back child feeling rather jealous also delighted living time nine year old child parts world read thousand books year wishes able,0
still feel like im getting away something naughty,1
guess sometimes arent aware true feelings playful kiss exposes,1
also know feels like relationship feel like burden much not worth loving pursuing,1
remote feel terrific great worth,1
know solved anything sure would momentarily made feel less agitated sure,0
wasnt one feeling pleased laurie beside old structures artefacts still sitting around untouched pretty much condition day last locomotive went,1
remember feeling thankful able put feet enjoy taking care newborns right id able take care,1
feeling humorous put cold callers hold,1
feel like im distracted days,0
feel blessed given chance love,1
feel one many standouts feist dare say masterpiece album reminder broke usual barrier audience performer,0
survived low part crash im starting feel hopeful,1
grabbed dog hugged fiercly next hour began feel bit like havent completly shaken feeling feeling rather depressed anxious day,0
rarely respond comments made unless feel important specific reason,1
needed know mattered feelings important mattered enough pursued cherished protected,1
feel like trying convince skeptical disbelieving person world yes really bipolar disorder,0
feel inside not vain,0
hear know well feel safe,1
went script would like mustard sauce started feel really startled,0
feel people reason duty awaken sincere mislead people educate fact god gave us reason ancient ignorant men gave us revealed religions,1
feel adventurous willing take risks img src http cdn,1
actually thought would feel bothered since ehb woman ow spent quite bit time together didnt feel much anything,0
feeling energized productive creative,1
im feeling combination terrified relieved,0
feel caring concern ron especially wife feel close connections,1
already feeling burdened write write write,0
make feel useful fucking guy,1
feel may vital fiction,1
feel scared,0
feel troubled,0
feeling like citizen feel welcomed japan english teacher home country black person,1
im feeling today liked books read made list tomorrow would different,1
slicing knife creamy cheesecake could imagine exactly would feel eager mouth,1
ive got learn mindful feel time not im suspicious feeling,0
grab air smooth frame feels cold touch,0
cant believe moment feel useful im washing dishes,1
feel even alone although,0
thankful least feel well enough sit husband kids table even minutes felt like passing carson actually accomplished sweet potatoes no less poor guy tired,1
feel like plan make happy allow help family better many ways,1
feel little damaged,0
im sorry feel uncertain,0
im still feeling groggy got hours fine,0
tried sometimes spend time make feel less miserable school usually offers thrown back face,0
good feeling presentation reactions audience fine,1
feel blessed know admire things accomplished,1
feel proud announce dr,1
would think oh poor lady always sick always stressed feeling isolated,0
feel eyes hateful eyes side glass belong family members beautiful victims,0
feel invigorated even though caffeine free,1
swear mean browns fail tomorrow night make feel like idiot not trusting gut feeling going lose tomorrow not picking win season,1
feel like parents ones think acceptable dont know want life dont feel need,1
breathing treatment laid bed felt like complete crap couldnt sleep called thinking really need get steroids ill feel fine right,1
must admit feeling popular wonderful feeling,1
im feeling disillusioned right,0
feel subaru stops innocent presented beginning begins turn depressed young man also kicks ass,1
thankful,1
begin process emotions also feeling pregnancy would welcomed different physical conditions thoughts next blog,1
overcome claustrophobic feeling get dont know know path need follow get vision need make sure road choose lead,1
constantly overwhelmed feeling not smart enough not pretty enough not nice enough not talented enough worst not enough make things better,1
im feeling bit suspicious,0
like feel respected guy not abused,1
still feel guilty day taking spot,0
feel sorry seeing parents,0
find feeling shocked hearing word spoken loud lounge room,1
really didnt feel much despite terrific acting,1
feel less keen winston churchill quote really feel less keen winston churchill quote href http,1
feel good project,1
say name feel change nearly violent desire reigns difficulty first waves orgasmic stupor envelops,0
year old girl wanted feel important,1
im not making sort music feel useless,0
think left teach feel little frightened thought family changes moves away things need know order feel complete,0
feel less doubtful towards person sincerity rebuilding relationship,0
rarely left meeting feeling angry upset,0
im excited see goes least feel like im something rather sitting around feeling unhappy things,0
put aside feeling little defeated,0
actually feel excited first time long time,1
go feeling foolish many times,0
cant shake mood feel listless unsettled relaxed,0
tell awful comment made feel not supportive condescending,1
feel fearless right,1
ive feeling really shitty lately,0
feeling happy,1
made chilli oil monday feeling dangerous,0
feel gracious hand,1
feel wonderful grateful support,1
feel adventurous willing take risks img src http cdn,1
almost feel damaged,0
feel like pathetic hellip hellip even director saw want rather drama want try sitcom,0
reach feeling uncertain needing support slap upside head know provide,0
feel nothing replies suddenly relaxed,1
im already wrote feeling like im portraying sweet girl brat,1
feel matters hand resolved no tears self pity,1
id rather no one know really feel sometimes compassionate sometimes beautiful,1
feel proud know several people deserved advanced finally picked time around last time peoples cases,1
representative everything thats wrong corporate america feel sending washington ludicrous idea,1
learning one default reactions feel threatened,0
want see put effort making happy special making feel assured,1
could feel gloomy london fog oppressive tropical heat even though vacation oregon,0
stopped feeling bitter sorry lost work work started getting better rather continued get better,0
instead feel restless,0
feel something strong others take,1
feel carefree young amazing,1
feel horrible winter,0
revise replies mind make sure reply sounds appropriate enough person receive reply not feel offended,0
feel romantic passionate partner,1
couldnt help feel little place casual attire,1
not really financial straits yet feel insecure,0
feeling extremely homesick first two days,0
sit sipping pear blueberry smoothie im feeling pretty smug,1
could somehow stop everyone earth ever feeling heartbreak would one happy lady,1
already feel kicking ribs making harder breath sometimes taking precious space stomach,1
feel caring wondering,1
miss nice see suck see always feel rushed,0
feel bit naughty making public remembered made feel like shit confidence stripped,1
able feel little bit emotional freedom,0
ive hated pretty much every shampoo ive tried without sulfates often feel make hair look dull produce pretty much no lather need bubbles,0
agree original comment water feel like song transcends time gorgeously romantic cinematic feel like watching story belongs someone else,1
learning deal nausea amp manage unpleasantness work trying keep anyone knowing sister told no need suffer amp feel miserable amp call dr zofran,0
ive also feeling somewhat emo irritable lately,0
view much like little sister habit building darkest days done remarkable job lately even asking advice makes feel valued,1
probably reason feel bit agitated,0
thought peers lacking months year vote feeling hopeless watch news every click refresh button last night,0
feeling mad dress mad mad dress,0
feel awful reading someones emotional posts especially mine,0
feel truly heartbroken hyun joongs fans hateful,0
im teenager people feel need make sarcastic bitchy comments kindly fuck,0
yet experienced totality getting use gifts without feeling like someone threatened jealous competing,0
feel real mellow,1
review film blog entry david sitting garden feeling slightly smug discovering film shortlisted best film entries,1
feel innocent,1
im kind feeling nervous anxious shit today,0
could try reach tongue lick vain close could feel divine warmth pussy vain,1
feel homesick,0
feel selfish talk anyone else thyroid not want think dramatic whiny really hard understand yes someone look fine still feel terrible,0
felt happy received letter telling admitted university,1
still feel chub wear cute summer clothes dreamed,1
breast feeding newborn wondering long breasts feel tender super large,1
feel like punished going school,0
see lovers feel envious want someone,0
read blog feel shes one person doesnt care people look believes no matter bitchy annoying self centered may seem people,0
feel like little innocent helpless person needs guess like needed,1
feel well enough cook,1
felt next step dont want doubtful feel dumb keeping hope much money come short time,0
feel horny thigh high nylons,1
realise desiring substance feed feeling compounds desire feed feeling realise ive abused substances since early childhood,0
feeling bit rushed kitchen cleaned mixed blender find works well provided butter really cold dont pulse,0
panicked feel nails broke impenetrable wall ice leaving red crescents blood welling sensitive skin,0
spend energy making world live better place everything power not kick people feel superior others dont challenges,1
feel strange sorts wont resort,0
feeling regretful recently not know back abuse not fault not happen,0
im feeling really stressed today state house,0
feel know get little glimpse lives feel sad sad happy things go right,0
came across something made feel lousy,0
feel honored show students excited giardina said,1
wont give much case feel greedy,0
share feel valuable information,1
admit feel amused see pti jamiat whole lot others media try avoid suggestion actually protesting use sharia case raymond davis release,1
feel happy,1
feeling particularly bitchy dont think adequately expressed appreciation,0
feel little sociable today,1
hate feeling alone,0
beginning feel like fabulous adult,1
feel longing near dont,1
tried answer generally could ive struggling work lately feeling pretty morose,0
feel good investment make building restaurant,1
feel discouraged beaten better pray obviously call mama friends,0
not feel faster stronger,1
feel command useful check free space log file databases go,1
not sure feel think felt like already knew already sort accepted,1
woke early morning feeling joyful,1
use moments opportunity feel radiant beautiful soul hidden long behind walls,1
spent majority trying change look order feel accepted others feel loved feel better people around mind physicality offer,1
feel like im almost uh afraid everything speak,0
constitution also not feeling deprived lucky,0
sure feel sorry happened friend diego friend right,0
feeling sorry,0
started get feeling longing looked quilts display,1
feel overwhelmed,1
feel like rude ignore people,0
feel kind talented right lol hm,1
feel fine tweet name fb share type button count share url http,1
also feel strongly supporting local economy past years proud driven gm cars gm community,1
wanted write feel purged repressed feelings,0
feel regretful happened us,0
go coeur alene im surrounded feels strange look think people actually nuts,1
started feeling dazed,1
vividly remember feeling offended would even dream thing could choice,0
ive lived long feeling shitty picked feeling like odd one,0
spent first day feeling pissed thanks tourism hospitality workers trump thailands comparatively feeble efforts fleece gullible white people,0
ive worked plenty yet find one leaves feeling satisfied way ive spent another day never get back,1
want feel energetic rested,1
not describe happy feel emotional may sophat year old patient kandal said recovery room,0
feel like super hero naps amp sleeps crib,1
like reading feeling sympathetic people mind creates descriptive background scenes author describes,1
feeling bit gloomy weekend maybe grey days weve,0
feeling though something worthwhile rewarding dont feel need stay home hide laptop much,1
feel joy anticipation divine right,1
feeling absolutely ecstatic morning,1
think biggest problem rather turning something like people feel need become victimized something nothing blog nd rate publications generous,0
know feel sorry feel like,0
feeling doubtful confused lost not,0
great friends great housemates listened feel reminded unimportant enjoy life proud,0
im sinking back feeling rejected also wondering could done differently,0
feel like little kid punished mother something wrong,0
im feeling little stressed,0
feel fine class pin button count layout horizontal pin,1
given appointments oncologists radiologists per protocol following breast cancer surgery admit feel strange,0
im not really bashing gw hobby people try hard focus subjects feel passionate want spend time right,1
not talking relationships initial moment attraction first meet someone feel point abit disadvantaged,0
grateful strong support system internally externally rely feeling uncertain weak,0
feel bit confident heres gorgeous pair cream amp lemon shorts recently purchased warehouse sale,1
woke today feeling thankful,1
feel like th photo doesnt even look like real cute share,1
think possible feel romantic love point,1
laid bed hide feelings sweet girl crawled bed laid top said gently mommy whats bothering,1
feel fabulous apple flavor gets kicked side pumpkin,1
feel one thing enjoyed tv people time shocked kenny powers time let go love later,1
im stupid make feel like im worthless,0
feel rude put camera close anybody face situation,0
feel really angry sometimes love god havent enough,0
feel really valuable knowing considers worth sacrifice,1
feel need knock one beloved darlings list make room hugh laurie aka dr,1
feel shocked robbed shaken everything thought wanted,1
ive feeling helpless since superstorm sandy hit one favorite places world suspect lot share feeling,0
got feeling saying string along much sympathetic audience tell troubles,1
let feel way gorgeous partner loves intensity takes breath away beautiful comfortable home food table drink plenty dog adores,1
dun answer feel impolite answer talks dunno wat,0
crappy week still feeling agitated like day wanted,0
feel horrible time,0
feel hateful everything suddenly,0
feel empty cheated name friendship broken,0
arabia indigenous believers christ often feel isolated alone,0
highly talented bunch roling cyclinders,1
feel little less inhibited class tonight,0
feel strange sensation course limbs,1
feel intimidated tasks feel overwhelmed huge complicated tasks,0
looked back feeling desperately curious,1
feel like damaged goods deserves better,0
feel fond want squeeze tightly not unusually,1
brandish article anyone makes fun staying bed late whenever feel tragic staying,0
sense wat let feeling unsure,0
id make ways could celebrate today youre ready creative self self worker need ways feel festive,1
feel artist puts forth piece work even ones not agree respected even sake overcoming shackles society norms,1
feel like life rich fulfilling know people look way live feel misplaced pity,1
feel resentful really work resentment blow,0
went quite years feeling scared create,0
feel comfortable around,1
giggle nervously feel threatened,0
feel eager please,1
admit sort mexigoth feel vibe fond,1
cross border become foreigner feel never beloved land,1
love colors way yarns feel also love supporting small businesses allows provide quality products shop,1
feel though fucked majorly summer im cast alternate universe went wrong way timeline im stuck world one knew one way,0
feel whos work worthwhile world actually makes cry,1
im feeling little convinced,1
feel gracious hand upon life,1
feel superior feel worthless feel everyone else,1
make sugar laden roasted chocolate cake like best em nobody even tell vegan phase perfectly understandable year old girl feel thrilled vegan wish continued success health,1
feel kind awkward goes,0
im taking heart gentle perfect time place fearlessness wholesale change,1
im around husband home alone thinking feel hopeless,0
remember feel especially impressed start fresh new remove clutter,1
wasnt feeling energetic,1
love life feel optimistic lucky,1
realized goddamn fat ass greedy son bitches made feel humiliated alone ugly,0
wear one rare occasions pregnant feel cute,1
feel like job worth caring shifty,1
roommates lack consideration,0
purposely put statement negative show im feeling gun shy,0
feel hold somehow ive given time consolidation curious feeling,1
id fancy feel particularly delicious either,1
alternate feeling embarrassed excited almost teen sister share similar interests books,0
feel like getting fucked,0
feel empty,0
feel like shamed body felt pressure socially acceptable body size,0
feel really no point loving getting know true color,1
feel jaded stpm sigh,0
struggled thyroid waking day not feeling well seeking answers fix whatever wrong could get feel good,1
feel like parts repressed buried long surfacing,0
feel horny class arialblue href chat,1
im also feeling energetic able keep going better part day,1
feel blessed people life remind time right thing look better like,1
really loved day made feel gratitude wonderful day made feel happy,1
im overwhelmed feeling blessed pray fears last time say happy birthday,1
feel pretty productive although couldve cut back thinking usual,1
feel brave tubing even going try ice climbing nipigon dog sledding,1
still feel little bit funny discover fb damn,1
thought maybe get today crying already feeling incredibly depressed,0
feeling thankful many people care art want make things,1
ended shoeless making feel even vulnerable slowing,0
started feel cranky tired resupplied vitamins,0
compere party efforts get show rolling thwarted immobile,0
feel rebellious wish could things legally cant smoke drink drive,0
feel miserable,0
im feeling bitter knight shining denim asked year ago go gym wouldnt spend money,0
feeling little disappointed little hair improved stickiness lingering,0
imagine would feel hold nothing perverse know feel heat breathe moving feet tangled mine,0
im feeling amorous tonight never,1
feel extremely dangerous wandering sea,0
could checked back feel like got greedy took shot endzone throw right ball wanted throw got picked,0
feel angry alone unwanted vexed irritable time,0
feel honored even mentioned sentence derek,1
feel less frightened grounded centered,0
feel completely burdened intelligence,0
think would agree feeling toes fingers go numb perhaps one unpleasant feelings ever,0
im feeling hideously guily somewhat naughty work time,1
want know feelings never felt ever experience gentle touch,1
feel stubborn resistant therapy,0
no immediate response though feel could said many things convince love nice easy,1
climbing mountain see view,0
really like thrilled see take us another hand feel drama seems bit messy,0
really hard worker feel quite loyal places work,1
feel successful family work life,1
feel sexually threatened guys assholes fuck course im going bitch whatever need get ass situation,0
shared previously tv program another minor disagreement bed left feeling rejected lonely,0
feel frantic beat heart cookie voice surprisingly clear,0
feel pretty strongly not giveaway gain numbers,1
doubt anyone entirely honest thats ok may not feel perfect feel happy thats one hell improvement,1
blogging short time fact today marks three month blogoversary feel accepted community,1
ive thinking recently theres times ive overwhelmed gratitude point tears times im thinking im im feeling incredibly ungrateful maybe also point tears wondering,0
also feel angry mad bitter nor anyone,0
feel eager,1
feel bad talk oversharing much people think diary life,0
suggest give listen feel like blessed,1
ive procrastinating post birthday entry well past fact feels somewhat unimportant even mention,0
know cant ged rid feelings seriously dont see parents supporting dating guy age,1
always thought contracted something one people passed feel awful got sti test thought basically clear,0
wearing heels feel self assured,1
feel drastically inadequate needs feel swirling around,0
feel embarrassed enough,0
feel like popping face fist obnoxious,0
like type assumptions makes feels bit positive,1
know feeling thought wished could us us knew however much hated first experience would remember forever,0
know not tried new character yet universe feels much lively began hoping true new characters well,1
feel quite nervous scared scared cos ill taking plane back singapore cos cant stay long two friends planned,0
writing feeling appalled,0
sit six weeks sabbatical feel completely worthless,0
feel like flying im afraid im going miss something,0
hear still cool several times day makes feel cool,1
need work better nutrition time feel amazing,1
