text,sentiment
say couple things twice order not weird context laughter mix would make tv audience feel like theyd missed joke,0
viewed back new year card presented feel sincere,1
also need remember bad overeating makes feel not fullness hangover get food thats rich sugary,1
see look doubt face feel scorn eyes anyone skeptical grits dinner grits please see totally amazing sister mashed potatoes,0
im sick feeling crappy,0
feel guilty leaving,0
prepare feel thankful events touch upon many different concerns poetry language issues pacific aesthetics avant garde eco poetry,1
feeling going amazing artist like daddy uncles,1
feel peaceful whole situation,1
feel one everything meet even return body beloved father indeed beginning realize meaning unearthly love sought long,1
feel though cant bear motion quilting even though idea delighted ago,1
ive done not writing flowers delivered someone brought meal new mom day feeling overwhelmed im stumped trying remember done,1
think decent scheme worked generous enough provide average player plenty free experience without forcing feel crappy pay get enjoyable game,0
feel little impatient especially thinking scoundrel coming impose,0
im going life feeling rather totally numb,0
feel like someone strange uncle trying break ice party showing amazing talent thinking guests impressed turn made everything hundred times awkward,0
feel like thats petty convince dont give shit,0
feel insulted offended hurt,0
think book wrote feel like talked incessantly gracious beautiful think coming close point no longer hand words anymore point hands,1
im feeling nostalgic happened last four years,1
not feel emotion deeply saddened stunned matter,1
feel weird guess kind happy,0
ive decided exes real strong feeling whether love extremley caring cant friends eventually blow face,1
feeling blank space right testicle area think right testicle size decrease urinate system semen,0
feel petty thinking like feel stupid let things get easily,0
start feel emotional,0
know told feel intimidated smart,0
suppose felt odd different liked feel accepted even superficial level hour two,1
actually feel frightened people right,0
think goes back never feeling accepted growing learned internal diatribe need let go,1
feeling going happen accepted job offer life likes throw lots curveballs,1
kept money would feel greedy,0
feel sympathetic embarrassed betty tough watch,1
wake feeling beaten dont feel way right im probably going tempted lake,0
highly recommend not band general know might seem familiar girl sort sincere anyway stuff good,1
morning filled feeling possibility gentle morning haze nyquil,1
im feeling hopeful thankful supportive family helping transition,1
sure prompted thought since feeling blessed days idea giving part thought process rarely long remember,1
feel cute feel good,1
feel like fearful first threw leg top tube surgery,0
questioned wondering didnt feel jubilant,1
feel sense comfort nostalgic sweetness,1
feeling cool night got right,1
feel optimistic everything long time,1
know sure feeling,1
feel books shelves,1
know feel beyond thrilled fall show happen paris,1
barely maintain long distance relationships im invested feeling shitty alone,0
could loose job would amp ed xmas hate xmas hate holidays wish would go away feel nervous feel sad disappoint family friends,0
im starting feel graceful oh happiness,1
im not feeling mellow,1
must say initial splash not bad strokes could feel cold getting bones,0
thinking ecology metaphor second language studies time feel like thought elegant words ever,1
find hard feel jolly throngs people around lost fervor getting stuff cant see heart green wallet encouraged constant barrage pressure every angle shop buy,1
feel like no way humiliated asa guy obssessed played embarrassing joke getting caught tabbys wife tabby lover married blindly fell love,0
got feel sweet girl kick belly never intimacy,1
around feeling fearless excited,1
feel charming,1
feel honored would think inspiring,1
feel like life movie sweet home alabama,1
learning learning lesson no matter feel even others may feel treasured god,1
really feel bad,0
feel anything strange tugging relieved say least,0
sat car read book suited fine also wasnt feeling sociable morning due rather bad nightmare night reading book best thing,1
think like australians know image well interesting see feel yes lovely kay going view sunrise,1
ill admit awesome feeling many time didnt know say froze went mind blank observing,0
feel like ive hit sweet spot life,1
feel getting gifting life time subscription vital,1
great relationship blessed strong male life truly treated like princess,1
feel bad im posting blog late,0
feel like ive hit sweet spot life,1
feel isolated even around people,0
cant feel dont turn back wont ignored time wont heal dont turn back wont ignored,0
feel still forgive called pervert hey im sorry totally life,0
wasnt feeling optimistic would nod universe trying,1
want without feeling inhibited,0
also love complimented substantially feel like look shitty,0
feel accepted condition,1
telling obbie last night feel like terrible christian,0
feel people scared given,0
want feel foolish ridiculous embarrassed self conscious,0
feel even bothered bothered boy probably even thinking,0
tired feeling awful,0
something tell girls finally feel brave enough share news,1
feeling pretty lovely yarn im stash busting well bonus,1
honestly think possible feel romantic love point,1
dont feel amazed,1
think back jesus many miracles feels like takes case individually heals way loving helpful,1
busy analysing wrong end feeling bitter things makes happy,0
honored wear usa back,1
never met real life feel super bonded crisis pregnancies genius children new friend sara href http everybitterthingissweet,1
feel sorry writers even drecky writers pay pretty good cover done,0
almost lost feelings gloomy world,0
work company makes feel valued even work miniscule feel though integral part operation,1
im also eating much nutritious food feeling energetic result,1
want avoid feeling disliked,0
disinterested read leave feeling inadequate,0
woke morning hours interrupted sleep feeling lousy mostly legs,0
empty disappointed angry sad chaotic destructive feel today im mad always fuck shit,0
feel badly daughter thats tragic,0
might push little hard sometimes feel better no one else,1
feeling not going pleasant,1
feeling crappy going hill entire week,0
close friend intimate bodily relationship girlfriend started avoid didnt want talk,0
overwhelming feeling truly blessed,1
im feeling hopelessly restless,0
feel slightly saddened know kids also resigned absence,0
feel bit lonely writing not face face someone cant get feedback,0
mean geez cara raised not feel compassion love feeling tortured beaten young age thats mord sith work,0
im guessing everyone standing feeling timid moving crowd,0
think right know neighbour see feeling envious embarrassed tell difference walk guy walk guy,0
feel smart avoided making pages cumbersome additionally avoided clumsiness trying introduce characters,1
feel overwhelmed might say stomach hurts head hurts,0
feel content achieved know write still tomorrow,1
walked feeling not really terrific humor story made appreciate going time saw struggles lend triumph said,1
started getting back track health wise already feel relieved,1
concentrate anything else feels miserable,0
feel peaceful together,1
grow learn mature little really makes feel sense joyful peace within,1
feel distraught right,0
feel regretful didnt bring overnight gear,0
plate without stress feeling completely overwhelmed,1
feel like could face day clung onto verse lord gracious compassionate started morning,1
feeling little overwhelmed like every year time speed holiday season creeps us,1
realized passionate helping women feel accepted appreciated,1
feel lucky guest posting kristi href http,1
feeling stubborn ridiculous possibly several colourful turns phrase children still asleep tip tongue settled heaving sigh turning leave,0
walked away feeling little dismayed ive got mission carry,0
told making feel unimportant insignificant,0
not used around grandeur found feeling intimidated,0
uncomfortable feeling weird feelings sure contractions since never really felt contractions jared jacked pitocin,1
want feel respected even things understand,1
feel fine,1
also feel sidebar messy,0
feel like federer talented player sure,1
love actually made feel dismayed disappointed,0
feel charming feel whimsy,1
ive found made huge difference especially finger ring skin feels much softer less irritated,0
feel hateful morning,0
would feel excited waiting mailman come house handing letters,1
reconciled life goes marriage feel terrible one affair,0
feel like strangling horny bastards schools people banging boats not even syaing sorry,1
feel nervous,0
seen solopgangfor see love woman eyes feel touch precious barnog know mother love,1
feeling reluctant players even finding library sage identify stuff,0
walk away church feeling invigorated ready embrace week,1
feel freakishly optimistic really runs natural character,1
tend window shopper im alone theres always going self imposed limit one two im feeling naughty,1
friendly easy talk open knowing friend not top approach cos feel intimidated know not want offend somebody shut,0
im feeling really adventurous maybe white,1
feel like pretty productive days although couldve cut back thinking usual,1
cant simple math question guess broke front tuition teacher known almost years feeling pressured feel bad bout,0
feel much alarmed prospect seeing general jackson president,0
feel slightly awful,0
im feeling irritable todays class,0
insist insist mother feel like pretty rotten one,0
feel like mouse among men perpetually terrified,0
feel bad dont groupie shot dan,0
want want starting feel resentful missing signals sending,0
feel bit dressing summer mostly jeremy scott murua amp glad news,1
feel manifesting strange ways,0
feeling pretty gloomy started writing dreaded time year course burnt nd set cake pops baking lost game monopoly game sucks,0
mean feelings always sincere think part tends repress certain things order somehow lessen blow eventually hit relationship ends,1
love feel hot beautiful sexy,1
feel little better sunday maybe continue good feeling get back little hot bod rocked,1
feeling making architecturally inspired window quilts summer,1
asked person approaching issue answer oh specific saying even though feel loved deeply completely accept,1
guess sometimes aware true feelings kiss,1
feeling beaten sick utterly devoid hope ever life want,0
feel envious proud time possible feel way,0
feel gloomy despite losing journalism gig last march,0
pray feeling unloved lonely,0
feeling sort heat exhausted,0
get involved tale good versus evil want feel afraid dark certain extent,0
ever recognized feel passionate something music,1
suggesting create happy environment live partner man feel like feelings important,1
feel terrified tell,0
ive feeling restless,0
feel relaxed whenever privilege love serve people,1
feel like going struggle fail suffer really dumb,0
feel supporting team traded musical chairs management rotation no proper manager,1
feel slightly like traitor admitting really liked new place,1
feel like im reliving prequel another jedi queen romantic relationship trying keep secret,1
describe wonderful close eyes remember cool feel mouth rich creaminess lightness,1
wanted make feel special particularly going putting long day work,1
may constant dullness heaviness heart makes feel restless bored unsatisfied however know well feelings evoked time month,0
feel honored witness another process,1
feeling particularly disheartened unmotivated today,0
didnt want hurt feelings fond avoiding conflict situations arise,1
feel im loving,1
feel wonderful see aku merasa luar biasa karena kulihat love light eyes,1
also feel transition piece still sweet classy adding touch goth punk rebellious style im falling lately,1
feel like going friends wonderfully innocent youthful fun,1
type words feel like surprised,1
think tomorrow tomorrow right tired already bit frustrated feeling completely drained,0
feel needs clever title cant think one,1
remember cammie couple months old looking sweet innocent face sobbing thinking going school thought someone would hurt feelings unkind unfair thought teacher might mean not love,0
feeling apprehensive also wildly excited,0
take lightly know harsh words leave people feeling absolutely devastated,0
skinny look thin love feeling ignored thinner try disappear,0
feel like shouldnt blamed never forgave,0
feel acceptable response times non crisis responses,1
feel rather intimidated impressive background clinic general,0
feeling terrific moment,1
wasnt going post anything death made feel mad shitty,0
synced itunes feel delighted music accessible no matter feature heavily life,1
wear anything not feel bad,0
feel running veins end unpleasant sight,0
ill make local friends go movies know fact wont even without meaning cause seriously doubt actual intention hurt feelings actually call heartless moral brainless came across way,0
feel socially anxious around ladies,0
begin write back god expressing thoughts feelings fears desires times feel soul content,1
im feeling frantic try remember breathe laugh,0
feel like totally vain totally necessary time,0
knowing day still makes feel not shy,0
could soon feel quite rejected,0
wan na feel gorgeous body yers underneath next time fuckin ya alex took deep breath eyes seemed glow imagined scenario mind scene pictured many times,1
feel really devastated feel like breathe,0
hadnt anticipated happening quite quickly new international life feeling passionate honduras,1
feeling content oh happy life,1
im tired feeling crappy hungry still dealing ridding house smell vomit,0
im afraid fuck like phil im perfect time life feels much flawless,1
im feeling pretty pleased,1
feel blessed cause thought mattered situation,1
search search search rarely feel satisfied solutions found,1
feel assaulted shit storm confusion anger hurt feelings tsunami us away,0
feeling unsure future,0
feel ive answered questions shes pretty trusting part,1
feel badly something makes really happy,1
would feel awkward someone tells feelings towards,0
no better word describe way feel heartbroken,0
feel idiotic wierd class,0
often feel dissatisfied least one project going,0
feel needy,0
bought doraemon backpack charity store every intention putting etsy store feel like cute sell,1
feel threatened reminded saved,0
never want rude even feel someone rude even want feel like need like crush offender thoroughly left tears front everyone sensitive,0
feel damn curious blond doctor plan night,1
need find ways feel pretty,1
ive feeling awhile looked surprised look said,1
feel clever recent comments href http,1
feel like vain cant right feel wrong heart mine,0
im little concerned ill look one day leaves ground ill feel like missed,0
enjoyed part entertainment value due fast mostly fun read also several qualms time left feeling dissatisfied,0
feel rather listless dull today slightly head achy good chances blahness throughout day,0
feeling like amy winehouse planning trip betty ford clinic upon less triumphant return australia,1
still feel slightly strange sorrow know not something god satan,1
started feeling funny friday woke sick dog,1
tgt still feel unhappy,0
finished college couple kids worked feeling entirely discouraged camera not functions wanted feeling like couldnt decent job taking pictures decided give another try,0
im like not even relieved done know could done better feel kind regretful,0
noticed body not happy eat red meat last week feeling lethargic little seedy nothing put seem,0
dont know one feeling feel isolated twitter well nobody isolating felt like among convos together im one keep talking happy drama ive following updating new episode,0
think main benefit wets surface giving even earliest strokes something play also helps get ass deep end pool feeling hesitant begin,0
feel unwelcome country,0
feel suffering turmoil also feels,0
writer block feel apprehensive writing next scene copy paste part new document write freely without feeling set stone saved manuscript,0
feel numb many fucking feels shorted feeling,0
feel like god gracious answering prayers,1
keep telling ill feel like celebrating ive passed boards date still determined,1
feel like copying handsome boy say yay fun,1
telling feeling bit homesick,0
shall move right along post interview portion day results far exciting interesting feel sure,1
feel bitter like really not,0
get feeling im butchering feeling delicate wordless,1
feel like drinkin drinkin angry someones gon na die whiskey beer les paul href http farm,0
im contemplating feeling skeptical,0
like guests feel like staying elegant pristine boutique hotel,1
feel joyful new beginning,1
eat biscuits crisps ice cream day yeah tastes great makes feel groggy following day take photos,0
im feeling pretty contented instructor assist higher level math helpful,1
cant sleep read happy posts go past one picnic day get happy im like james make happy love repeat soon feel jealous,0
heavy feel dull think stopped breathing,0
kept feeling wonderful ran couldnt believe,1
blamed people around making feel less valued stay home mom,1
feel rather disheartened suddenly,0
hope youre feeling fond,1
never realized awful mother feeling lack energy independence operation wimpy tired,0
feel like damaged corn big dent side label half torn grocery store everyone pushes side no one buys,0
feel quite clever,1
dont want beg feet courtney hows new project coming courtney would give affirmation dont feel like submissive slug,0
feels important voice knowing people read want say things think important hope might comfort others,1
feel pleased time really understand feel patriotism twice every year,1
im still feeling shaky realized felt intolerably hot time may mention polar opposite normally feel like,0
know im speaking feel like becoming stupid day,0
still good causes passionate volunteer friend introduced organization packs food rations families,1
feel anybody fully satisfied never going make progress sometimes feeling bad feeling bad act motivational tool,1
come home feeling drained paralysed try study brain shuts ill end snoring away bed visiting dreamland,0
feel lost days,0
feel terrified even time write feel mr,0
small town girl feel satisfied staying comfort zone jene work today boys braved windy city,1
feel complacent not like bothering,1
not feel,1
feeling melty miserable enough imagine must going,0
wanted everyone no matter lifestyle feel little bit glamorous,1
got house feeling fairly calm photographer weaving way bridesmaids touch ups dad telling story mom running house manage go list bridesmaids start clamoring dress,1
feeling rather cranky cos thinking lack sleep bah,0
brought bomber way feel like getting little convoy haulers well,1
left feel serence impressed man,1
run always run controlled pretty well dinner not even feel guilty,0
im not feeling absolutely terrified pain trauma already battered body,0
sorry amma made feel bad honest,0
feel redden manhood insulted demands satisfaction,0
feel self assured making decision move la try get point directing films,1
feel shocked many people talk havent seen movie,1
feel guilty may affect supply go back routine diligently,0
keep forgetting shouldnt no matter happens not hesitate feel ashamed come back allah get back feet,0
feel lip curl half smile amused way put,1
feeling bit disheartened know still lot things understand questions know,0
believe happy healthy relationships likely feel much energized inspired reflected overall health appearance,1
wonder even think back times begged side offer kind suport feeling caring,1
talk feel like lot gets resolved,1
try not let anxiety show make feel unwelcome,0
woke morning text mr declaring walking work typed miles therefore feeling virtuous,1
feel like need cry past days relieved could cry much tears today haha,1
feel joyful carefree,1
found feeling jealous though,0
began feel shaken badly would never repaired,0
im feeling gloomy completed nothing though im supposed complete many things,0
took chance kept crying hopes might feel benevolent,1
get ate wanted good sensation eating provided full feeling delicious soporific effect luscious hazy dreamy state ice cream gave going put torture,1
feeling ok lots bruising arms decided remove blood,1
feel like nothing pathetic,0
feel helpless depending people closest,0
feeling lied abused lenders,0
not remember mix heard first not remembering making feeling irritable,0
feel sure majority would go ios galaxy sii lumia,1
feel like intelligent person right,1
feel like im taking care needy puppy not living mother,0
feel fucking stupid,0
would always song stuck head bombing incident would feel bit weird dont really pay attention lyrics sounds like happy song not type youre supposed hum difficult days,0
bit bouncier usual didnt feel grouchy everything normal,0
got started one thing always gives joy even im feeling lousy,0
go bed feeling triumphant,1
im thankful music makes laugh music makes feel strong music makes believe,1
feel grouchy short tempered guilt kicks,0
know really mean anything feeling crappy find really wanting give wakeup call,0
feel like starting name susanna dont want boring,0
think really made us decide stay multiband made us feel valued listen fact student need homework,1
enclose verses could not weigh much thinking feeling curious hear odd couple,1
feeling smell not going pleasant,1
feel numb,0
feel little less gloomy little optimistic little better prepared face life throws way,0
already feel like ive accepted community,1
love life even feeling isolated,0
feel like im not joyful maybe hormones act like feel never lie,1
know feels tortured,0
feel lucky theyve chosen share lives,1
said feel ugly today,0
feel reading allthingsbucks blog tears eyes lump throat feeling not worthwhile upset shouldnt write lame,1
feel blessed beyond thankful opportunity paint readers best,1
no planning im feeling really bad,0
feel peaceful not particularly stressed anything,1
feel petty posting complaints right not like kidnapped years old forced make easter creme eggs rest life,0
feel caring person attract caring people life,1
crush bus mate feel strange used despise,0
look see stares feel also know sympathetic glances american friends give,1
always find way feel impressed,1
feel strengths determined motivated workout room,1
feel plight dogs lovely find turkish vet really cares,1
answer feeling clever,1
almost always feel fantastic exercise recommend every day,1
feel listless today aight,0
im feeling mentally burdened many things get done,0
feeling,1
signing prenatal yoga making effort get walks hopefully trips gym near future not gain less weight feel better,1
watch silently feeling dazed memory loss,1
im getting ready feeling stressed general take toll milk supply im not producing much,0
drove back beach staring thing seat beside feeling depressed,0
understood somewhere heart feeling decite abandonment hope ever trusting,1
feel ungrateful opportunity breathe air many others chances,0
glad helpful knowledgeable explorable,1
feel like weird sugar issues hunger place,1
feel kind dull grief,0
im feeling slightly empty right want reach hand someone anyone hold,0
walked away feeling discouraged technology seems replaced relationships many ways lately,0
trying really hard really want feel faithful close,1
guess comes believing younger anger not feeling acceptable tried not,1
already feel sleep deprived short time really want become person proud need start investing stop paying minimum amount credit card,0
awesome workouts feeling,1
im hurt feel unimportant,0
still feeling extremely damaged many different events seeming repeat havent given nor ever plan,0
ill tell soon im sure well talk purchase without feeling youre way supporting,1
feeling thankful warm sunshine crisp autumn air bright fall colors,1
feel strongly supporting brave men women sacrifice nation said begleiter,1
end feeling satisfied,1
assert better feel rich rich,1
feel like hopeless case beside,0
suddenly feeling insulted typing,0
feel like impatient mensa member times,0
thought would feel apprehensive surprisingly comfortable gone,0
feel nothing replies suddenly relaxed,1
feel romantic feelings soul begging god make ur love ur feeling ur soul wan na hear beat heart ever wan na otherwise nothing without,1
feeling shake shack love day guess look like hamburger dirty clothes hair luggage hadnt come yet,0
no word describe feeling reply said days today lovely country india never thought anything like ever happen everyone treated us gracefully humbly respect,1
talked therapist yesterday nothing feels resolved far anything ever gets resolved session,1
feel little confident school,1
think safe say learning experience one another honestly nothing positive feelings fond memories,1
labeled accuser reason feel responsibility bring attention information believed faithful,1
would feel timid wearing beacuse id try not get dirty etc,0
feeling eager press,1
know issues questions feelings etc going resolved,1
would feel strange describing anyone interested let know add,0
still feeling strong missed couple lifts,1
wanted feel convinced truly found place world without man considering book started ended relationship not thoroughly convinced,1
feel defeated extremely agitated well frustrated beyond words,0
always im not feeling sociable extreme,1
expert feeling rushed anxious getting worked frustrated feel overwhelmed job,0
feel soo lucky,1
dropped back sleep hour two realistic peculiar dreams stuck head making feel bit dazed,1
love tv mounts feel handsome advance not looks great saves ton plot attracted receiving one put roots first like population,1
think today days april fools day made feel foolish sharing results extensive research people,0
kind feel like sincere,1
